[
  {
    "id": "smith-john",
    "name": "Dr. John Smith",
    "title": "Professor of Finance",
    "department": "finance",
    "email": "jsmith@illinois.edu",
    "phone": "217-333-0001",
    "office": "BIF 4025",
    "url": "https://giesbusiness.illinois.edu/faculty/john-smith",
    "researchAreas": [
      "Corporate Finance",
      "Mergers & Acquisitions",
      "Capital Markets"
    ],
    "education": [
      {
        "degree": "PhD",
        "field": "Finance",
        "institution": "University of Chicago",
        "year": 2005
      },
      {
        "degree": "MBA",
        "field": "Finance",
        "institution": "Northwestern University",
        "year": 2000
      },
      {
        "degree": "BS",
        "field": "Economics",
        "institution": "University of Illinois",
        "year": 1998
      }
    ],
    "publications": [
      {
        "title": "The Impact of M&A on Firm Value",
        "journal": "Journal of Finance",
        "year": 2023,
        "citations": 150
      },
      {
        "title": "Capital Structure Decisions in Emerging Markets",
        "journal": "Review of Financial Studies",
        "year": 2022,
        "citations": 95
      }
    ],
    "courses": [
      "FIN 300",
      "FIN 450",
      "FIN 560"
    ],
    "bio": "Dr. Smith is a leading expert in corporate finance with over 20 years of research and teaching experience.",
    "lastUpdated": "2025-11-19T23:29:41.320359"
  },
  {
    "id": "johnson-sarah",
    "name": "Dr. Sarah Johnson",
    "title": "Associate Professor of Accountancy",
    "department": "accountancy",
    "email": "sjohnson@illinois.edu",
    "phone": "217-333-0002",
    "office": "BIF 3015",
    "url": "https://giesbusiness.illinois.edu/faculty/sarah-johnson",
    "researchAreas": [
      "Financial Reporting",
      "Audit Quality",
      "Corporate Governance"
    ],
    "education": [
      {
        "degree": "PhD",
        "field": "Accounting",
        "institution": "Stanford University",
        "year": 2010
      },
      {
        "degree": "MAcc",
        "field": "Accounting",
        "institution": "University of Texas",
        "year": 2005
      }
    ],
    "publications": [
      {
        "title": "Audit Committee Effectiveness and Financial Reporting Quality",
        "journal": "The Accounting Review",
        "year": 2023,
        "citations": 200
      }
    ],
    "courses": [
      "ACCY 201",
      "ACCY 405",
      "ACCY 570"
    ],
    "bio": "Dr. Johnson's research focuses on the intersection of auditing and corporate governance.",
    "lastUpdated": "2025-11-19T23:29:41.320362"
  },
  {
    "id": "chen-wei",
    "name": "Dr. Wei Chen",
    "title": "Assistant Professor of Business Administration",
    "department": "business-administration",
    "email": "weichen@illinois.edu",
    "phone": "217-333-0003",
    "office": "BIF 2020",
    "url": "https://giesbusiness.illinois.edu/faculty/wei-chen",
    "researchAreas": [
      "Organizational Behavior",
      "Leadership",
      "Team Dynamics"
    ],
    "education": [
      {
        "degree": "PhD",
        "field": "Organizational Behavior",
        "institution": "Harvard Business School",
        "year": 2018
      },
      {
        "degree": "MBA",
        "field": "Management",
        "institution": "MIT Sloan",
        "year": 2013
      }
    ],
    "publications": [
      {
        "title": "Leadership in Diverse Teams",
        "journal": "Academy of Management Journal",
        "year": 2023,
        "citations": 85
      }
    ],
    "courses": [
      "BADM 300",
      "BADM 450"
    ],
    "bio": "Dr. Chen studies how leaders can build and manage effective teams in diverse organizations.",
    "lastUpdated": "2025-11-19T23:29:41.320367"
  },
  {
    "id": "patel-raj",
    "name": "Dr. Raj Patel",
    "title": "Professor of Finance",
    "department": "finance",
    "email": "rpatel@illinois.edu",
    "phone": "217-333-0004",
    "office": "BIF 4030",
    "url": "https://giesbusiness.illinois.edu/faculty/raj-patel",
    "researchAreas": [
      "Sustainable Finance",
      "ESG Investing",
      "Impact Investing"
    ],
    "education": [
      {
        "degree": "PhD",
        "field": "Finance",
        "institution": "Wharton School",
        "year": 2008
      }
    ],
    "publications": [
      {
        "title": "ESG Factors and Stock Returns",
        "journal": "Journal of Financial Economics",
        "year": 2024,
        "citations": 120
      },
      {
        "title": "The Rise of Impact Investing",
        "journal": "Financial Analysts Journal",
        "year": 2023,
        "citations": 75
      }
    ],
    "courses": [
      "FIN 321",
      "FIN 501"
    ],
    "bio": "Dr. Patel is a leading researcher in sustainable finance and ESG investing.",
    "lastUpdated": "2025-11-19T23:29:41.320368"
  },
  {
    "id": "williams-mary",
    "name": "Dr. Mary Williams",
    "title": "Clinical Professor of Accountancy",
    "department": "accountancy",
    "email": "mwilliams@illinois.edu",
    "phone": "217-333-0005",
    "office": "BIF 3020",
    "url": "https://giesbusiness.illinois.edu/faculty/mary-williams",
    "researchAreas": [
      "Tax Accounting",
      "Professional Practice"
    ],
    "education": [
      {
        "degree": "PhD",
        "field": "Accounting",
        "institution": "University of Illinois",
        "year": 2012
      },
      {
        "degree": "CPA",
        "field": "Certified Public Accountant",
        "institution": "Illinois State Board",
        "year": 2005
      }
    ],
    "publications": [],
    "courses": [
      "ACCY 302",
      "ACCY 404"
    ],
    "bio": "Dr. Williams brings 15 years of Big 4 experience to the classroom, specializing in taxation.",
    "certifications": [
      "CPA"
    ],
    "lastUpdated": "2025-11-19T23:29:41.320372"
  }
]